{
 "schema": 2,
 "site": "nordic-crypto",
 "exported_at": "2026-10-12T07:31:17+02:00",
 "articles": [
  {
   "site": "nordic-crypto",
   "id": "07e49032be5a",
   "url": "https://www.kaupr.io/nyheter/safello-apner-for-at-andre-selskaper-kan-tilby-kryptokjop",
   "canonical_url": "https://kaupr.io/nyheter/safello-apner-for-at-andre-selskaper-kan-tilby-kryptokjop",
   "title": "Safello åpner for at andre selskaper kan tilby kryptokjøp",
   "source": "kaupr",
   "source_name": "Kaupr",
   "published_at": "2026-09-24T12:00:00+00:00",
   "first_published_on_site": "2026-10-03T17:59:40+02:00",
   "last_seen_on_site": "2026-10-12T07:31:17+02:00",
   "languages": [
    "en",
    "nn",
    "nb",
    "sv",
    "da",
    "fi",
    "is"
   ],
   "summaries": {
    "en": "Sweden's Safello is testing a setup that lets companies without their own crypto business offer crypto purchases under Safello's MiCA licence.",
    "nn": "Svenske Safello testar ei løysing som lèt selskap utan eiga kryptoverksemd tilby kjøp av krypto under MiCA-løyvet til Safello.",
    "nb": "Svenske Safello tester en løsning som lar selskaper uten egen kryptovirksomhet tilby kjøp av krypto under Safellos MiCA-tillatelse.",
    "sv": "Svenska Safello testar en lösning som låter bolag utan egen kryptoverksamhet erbjuda köp av krypto under Safellos MiCA-tillstånd.",
    "da": "Svenske Safello tester en løsning, der lader virksomheder uden egen kryptoforretning tilbyde køb af krypto under Safellos MiCA-tilladelse.",
    "fi": "Ruotsalainen Safello testaa ratkaisua, jonka avulla yritykset, joilla ei ole omaa kryptoliiketoimintaa, voivat tarjota kryptojen ostoa Safellon MiCA-toimiluvalla.",
    "is": "Sænska Safello prófar lausn sem gerir fyrirtækjum án eigin rafmyntastarfsemi kleift að bjóða kaup á rafmyntum undir MiCA-leyfi Safello."
   },
   "titles": {
    "en": "Safello opens up so other companies can offer crypto purchases",
    "nn": "Safello opnar for at andre selskap kan tilby kryptokjøp",
    "sv": "Safello öppnar för att andra bolag kan erbjuda kryptoköp",
    "da": "Safello åbner for, at andre selskaber kan tilbyde kryptokøb",
    "fi": "Safello antaa muiden yhtiöiden tarjota kryptokauppaa",
    "is": "Safello opnar á að önnur fyrirtæki geti boðið kaup á rafmyntum"
   },
   "topics": [
    "business",
    "mica"
   ],
   "removed": 0,
   "removed_at": null,
   "removal_reason": null,
   "updated_at": "2026-10-12T07:31:17+02:00",
   "country": "SE"
  },
  {
   "site": "nordic-crypto",
   "id": "08a682f7d85d",
   "url": "https://www.kaupr.io/nyheter/btcx-blir-megler-og-goobits-rapporterte-inntekter-faller",
   "canonical_url": "https://kaupr.io/nyheter/btcx-blir-megler-og-goobits-rapporterte-inntekter-faller",
   "title": "BTCX blir megler, og Goobits rapporterte inntekter faller",
   "source": "kaupr",
   "source_name": "Kaupr",
   "published_at": "2026-09-10T12:00:00+00:00",
   "first_published_on_site": "2026-10-03T17:59:40+02:00",
   "last_seen_on_site": "2026-10-12T07:31:17+02:00",
   "languages": [
    "en",
    "nn",
    "nb",
    "sv",
    "da",
    "fi",
    "is"
   ],
   "summaries": {
    "en": "Goobit is switching BTCX from proprietary trading to brokerage, citing MiCA, which cuts reported revenue but not gross profit.",
    "nn": "Goobit legg om BTCX frå eigenhandel til mekling med tilvising til MiCA, noko som reduserer rapporterte inntekter, men ikkje bruttoforteneste.",
    "nb": "Goobit legger om BTCX fra egenhandel til megling med henvisning til MiCA, noe som reduserer rapporterte inntekter, men ikke bruttofortjenesten.",
    "sv": "Goobit ställer om BTCX från egenhandel till förmedling med hänvisning till MiCA, vilket minskar de redovisade intäkterna men inte bruttovinsten.",
    "da": "Goobit lægger BTCX om fra egenhandel til formidling med henvisning til MiCA, hvilket reducerer den rapporterede omsætning, men ikke bruttofortjenesten.",
    "fi": "Goobit siirtää BTCX:n omaan lukuun käytävästä kaupasta välitykseen MiCA:an vedoten, mikä pienentää raportoitua liikevaihtoa mutta ei bruttokatetta.",
    "is": "Goobit færir BTCX úr viðskiptum fyrir eigin reikning yfir í miðlun og vísar til MiCA, sem lækkar skráðar tekjur en ekki vergan hagnað."
   },
   "titles": {
    "en": "BTCX becomes a broker, and Goobit's reported revenue falls",
    "nn": "BTCX blir meklar, og dei rapporterte inntektene til Goobit fell",
    "sv": "BTCX blir mäklare, och Goobits rapporterade intäkter faller",
    "da": "BTCX bliver mægler, og Goobits rapporterede indtægter falder",
    "fi": "BTCX:stä tulee välittäjä, ja Goobitin raportoidut tuotot laskevat",
    "is": "BTCX verður miðlari og tilkynntar tekjur Goobit lækka"
   },
   "topics": [
    "mica",
    "business"
   ],
   "removed": 0,
   "removed_at": null,
   "removal_reason": null,
   "updated_at": "2026-10-12T07:31:17+02:00",
   "country": "SE"
  },
  {
   "site": "nordic-crypto",
   "id": "12425cc1e7ff",
   "url": "https://www.kaupr.io/nyheter/coinmotion-og-k33-inngar-nordisk-kryptosamarbeid-om-institusjonell-handel",
   "canonical_url": "https://kaupr.io/nyheter/coinmotion-og-k33-inngar-nordisk-kryptosamarbeid-om-institusjonell-handel",
   "title": "Coinmotion og K33 inngår nordisk kryptosamarbeid om institusjonell handel",
   "source": "kaupr",
   "source_name": "Kaupr",
   "published_at": "2026-09-24T12:00:00+00:00",
   "first_published_on_site": "2026-10-03T17:59:40+02:00",
   "last_seen_on_site": "2026-10-12T07:31:17+02:00",
   "languages": [
    "en",
    "nn",
    "nb",
    "sv",
    "da",
    "fi",
    "is"
   ],
   "summaries": {
    "en": "Finnish broker Coinmotion has picked Norway's K33 to execute large trades, a partnership between two MiCA-licensed Nordic firms.",
    "nn": "Finske Coinmotion har valt norske K33 til å gjennomføre store handlar, eit samarbeid mellom to nordiske selskap med MiCA-løyve.",
    "nb": "Finske Coinmotion har valgt norske K33 til å gjennomføre store handler, et samarbeid mellom to nordiske selskaper med MiCA-tillatelse.",
    "sv": "Finländska Coinmotion har valt norska K33 för att genomföra stora affärer, ett samarbete mellan två nordiska bolag med MiCA-tillstånd.",
    "da": "Finske Coinmotion har valgt norske K33 til at gennemføre store handler, et samarbejde mellem to nordiske selskaber med MiCA-tilladelse.",
    "fi": "Suomalainen Coinmotion on valinnut norjalaisen K33:n toteuttamaan suuria kauppoja; kyseessä on kahden MiCA-toimiluvan saaneen pohjoismaisen yrityksen yhteistyö.",
    "is": "Finnska Coinmotion hefur valið norska K33 til að annast stór viðskipti, samstarf tveggja norrænna fyrirtækja með MiCA-leyfi."
   },
   "titles": {
    "en": "Coinmotion and K33 strike Nordic crypto partnership on institutional trading",
    "nn": "Coinmotion og K33 inngår eit nordisk kryptosamarbeid om institusjonell handel",
    "sv": "Coinmotion och K33 ingår nordiskt kryptosamarbete om institutionell handel",
    "da": "Coinmotion og K33 indgår et nordisk kryptosamarbejde om institutionel handel",
    "fi": "Coinmotion ja K33 aloittavat pohjoismaisen kryptoyhteistyön institutionaalisessa kaupassa",
    "is": "Coinmotion og K33 gera norrænt rafmyntasamstarf um stofnanaviðskipti"
   },
   "topics": [
    "business",
    "mica"
   ],
   "removed": 0,
   "removed_at": null,
   "removal_reason": null,
   "updated_at": "2026-10-12T07:31:17+02:00",
   "country": "SE"
  },
  {
   "site": "nordic-crypto",
   "id": "2d38c9c89e0e",
   "url": "https://www.sydsvenskan.se/lund/uppgifter-tonaringar-silvertejpade-man-i-jakt-pa-kryptovaluta/",
   "canonical_url": "https://sydsvenskan.se/lund/uppgifter-tonaringar-silvertejpade-man-i-jakt-pa-kryptovaluta",
   "title": "Uppgifter: Tonåringar silvertejpade man i jakt på kryptovaluta",
   "source": "sydsvenskan.se",
   "source_name": "Sydsvenskan",
   "published_at": "2026-10-02T12:00:00+00:00",
   "first_published_on_site": "2026-10-03T17:59:40+02:00",
   "last_seen_on_site": "2026-10-12T07:31:17+02:00",
   "languages": [
    "en",
    "nn",
    "nb",
    "sv",
    "da",
    "fi",
    "is"
   ],
   "summaries": {
    "en": "Three teenagers have been arrested in Lund on suspicion of kidnapping after allegedly tying up a local man with duct tape to rob him of crypto.",
    "nn": "Tre tenåringar er pågripne i Lund, mistenkte for kidnapping etter at dei skal ha teipa fast ein lokal mann for å rane han for krypto.",
    "nb": "Tre tenåringer er pågrepet i Lund, mistenkt for kidnapping etter angivelig å ha teipet fast en lokal mann for å rane ham for krypto.",
    "sv": "Tre tonåringar har gripits i Lund misstänkta för människorov efter att de ska ha tejpat fast en man från orten för att råna honom på krypto.",
    "da": "Tre teenagere er anholdt i Lund, mistænkt for kidnapning, efter at de angiveligt bandt en lokal mand med gaffatape for at røve krypto fra ham.",
    "fi": "Lundissa on pidätetty kolme teiniä epäiltynä ihmisryöstöstä: heidän epäillään sitoneen paikallisen miehen ilmastointiteipillä ryöstääkseen häneltä kryptoja.",
    "is": "Þrír unglingar hafa verið handteknir í Lundi, grunaðir um mannrán eftir að hafa að sögn bundið mann á staðnum með límbandi til að ræna af honum rafmyntum."
   },
   "titles": {
    "en": "Reports: teenagers duct-taped a man in hunt for cryptocurrency",
    "nn": "Opplysningar: Tenåringar sølvteipa mann i jakt på kryptovaluta",
    "nb": "Opplysninger: Tenåringer sølvteipet mann i jakt på kryptovaluta",
    "da": "Oplysninger: Teenagere tapede en mand med sølvtape i jagten på kryptovaluta",
    "fi": "Tietojen mukaan teinit teippasivat miehen ilmastointiteipillä kryptovaluutan takia",
    "is": "Upplýsingar: Unglingar bundu mann með límbandi í leit að rafmynt"
   },
   "topics": [
    "crime"
   ],
   "removed": 0,
   "removed_at": null,
   "removal_reason": null,
   "updated_at": "2026-10-12T07:31:17+02:00",
   "country": "SE"
  },
  {
   "site": "nordic-crypto",
   "id": "4d918e6a3378",
   "url": "https://www.kaupr.io/nyheter/firi-tar-opp-kampen-om-1-1-millioner-svenske-kryptoeiere",